"name","price","description","url"
"The Artist's Way: A Spiritual Path to Higher Creativity","£38.49","","https://books.toscrape.com/catalogue/the-artist's-way:-a-spiritual-path-to-higher-creativity-9/index.html"
"The Art of War","£33.34","","https://books.toscrape.com/catalogue/the-art-of-war-9/index.html"
"The Argonauts","£10.93","","https://books.toscrape.com/catalogue/the-argonauts-9/index.html"
"The 10% Entrepreneur: Live Your Startup Dream Without Quitting Your Day Job","£27.55","","https://books.toscrape.com/catalogue/the-10%-entrepreneur:-live-your-startup-dream-without-quitting-your-day-job-9/index.html"
"Suddenly in Love (Lake Haven #1)","£55.99","","https://books.toscrape.com/catalogue/suddenly-in-love-(lake-haven-#1)-9/index.html"
"Something More Than This","£16.24","","https://books.toscrape.com/catalogue/something-more-than-this-9/index.html"
"Soft Apocalypse","£26.12","","https://books.toscrape.com/catalogue/soft-apocalypse-9/index.html"
"So You've Been Publicly Shamed","£12.23","","https://books.toscrape.com/catalogue/so-you've-been-publicly-shamed-9/index.html"
"Shoe Dog: A Memoir by the Creator of NIKE","£23.99","","https://books.toscrape.com/catalogue/shoe-dog:-a-memoir-by-the-creator-of-nike-9/index.html"
"Shobu Samurai, Project Aryoku (#3)","£29.06","","https://books.toscrape.com/catalogue/shobu-samurai,-project-aryoku-(#3)-9/index.html"
"Secrets and Lace (Fatal Hearts #1)","£20.27","","https://books.toscrape.com/catalogue/secrets-and-lace-(fatal-hearts-#1)-9/index.html"
"Scarlett Epstein Hates It Here","£43.55","","https://books.toscrape.com/catalogue/scarlett-epstein-hates-it-here-9/index.html"
"Romero and Juliet: A Tragic Tale of Love and Zombies","£36.94","","https://books.toscrape.com/catalogue/romero-and-juliet:-a-tragic-tale-of-love-and-zombies-9/index.html"
"Redeeming Love","£20.47","","https://books.toscrape.com/catalogue/redeeming-love-9/index.html"
"Poses for Artists Volume 1 - Dynamic and Sitting Poses: An Essential Reference for Figure Drawing and the Human Form","£41.06","","https://books.toscrape.com/catalogue/poses-for-artists-volume-1---dynamic-and-sitting-poses:-an-essential-reference-for-figure-drawing-and-the-human-form-9/index.html"
"Poems That Make Grown Women Cry","£14.19","","https://books.toscrape.com/catalogue/poems-that-make-grown-women-cry-9/index.html"
"Nightingale, Sing","£38.28","","https://books.toscrape.com/catalogue/nightingale,-sing-9/index.html"
"Night Sky with Exit Wounds","£41.05","","https://books.toscrape.com/catalogue/night-sky-with-exit-wounds-9/index.html"
"Mrs. Houdini","£30.25","","https://books.toscrape.com/catalogue/mrs.-houdini-9/index.html"